{
  "schemaVersion": "0.1.0",
  "scope": "task",
  "mode": "observe",
  "state": "COMPLETE",
  "reasonCodes": ["ALL_REQUIREMENTS_SATISFIED"],
  "verification": {
    "requirements": { "total": 2, "satisfied": 2, "violated": 0, "unverified": 0 },
    "acceptanceCriteria": { "total": 3, "verified": 3, "unverified": 0 }
  },
  "tasks": { "total": 1, "complete": 1, "unsupportedClaims": 0 },
  "unsupportedClaims": [],
  "unresolvedRefs": [],
  "evidence": [
    { "kind": "tasks", "state": "present" },
    { "kind": "diff", "state": "present" },
    { "kind": "tests", "state": "present" }
  ]
}
